<?xml version="1.0" encoding="utf-8"?>
<foo:LoggingEvents xmlns:foo="http://lilith.sf.net/schema/logging/10" xmlns:xsi="http://www.w3.org/2001/XMLSchema-instance" xsi:schemaLocation="http://lilith.sf.net/schema/logging/10 http://lilith.sf.net/schema/logging/10/LoggingEvent.xsd http://lilith.sf.net/schema/eventsource/10 http://lilith.sf.net/schema/eventsource/10/EventSource.xsd" startIndex="17">
	<SourceIdentifier xmlns="http://lilith.sf.net/schema/eventsource/10" identifier="primary"/>
	<foo:LoggingEvent logger="Logger" level="INFO" timeStamp="2008-03-19T12:09:55.140+01:00">
		<foo:Message>EventMessage</foo:Message>
	</foo:LoggingEvent>
	<foo:LoggingEvent logger="Logger" level="INFO" timeStamp="2008-03-19T12:09:55.140+01:00">
		<foo:Message>EventMessage</foo:Message>
	</foo:LoggingEvent>
	<foo:LoggingEvent logger="Logger" level="INFO" timeStamp="2008-03-19T12:09:55.140+01:00">
		<foo:Message>EventMessage</foo:Message>
	</foo:LoggingEvent>
</foo:LoggingEvents>
